{"apiVersion":"applications.sympoies.dev/v1","application":{"digest":"sha256:aaaaaaaaaaaaaaaaaaaaaaaaaaaaaaaaaaaaaaaaaaaaaaaaaaaaaaaaaaaaaaaa","id":"system-notification-editor","inputSchemaDigest":"sha256:bbbbbbbbbbbbbbbbbbbbbbbbbbbbbbbbbbbbbbbbbbbbbbbbbbbbbbbbbbbbbbbb","outputSchemaDigest":"sha256:cccccccccccccccccccccccccccccccccccccccccccccccccccccccccccccccc"},"attempt":1,"input":{"facts":[{"label":"state","value":"healthy"}],"fallbackText":"Service is healthy."},"inputDigest":"sha256:81f2914282b06009adceb4c7dde118842ac82ed14c69b9f333bf71c3b6cb36b1","invocationId":"notification-editor-20260913t120000z","kind":"BatchInvocationRequest"}
